rhino,0,I see the weapon system worked well?
boy,0,It did work, but it seems a bit weak.
rhino_surprise,0,You want more sophisticated weapons?
rhino,0,I've reopened my ^05garage^00 right next to me! You could buy better gear.
rhino,0,If you beat my highscore of 00:45 seconds on the track, I have a special gift for you.
rhino,0,And my radar picked up the two remaining ^04satellite pieces^00. I've uploaded the coordinates.
rhino,0,Use your map! And report back when you've found them. I am still working on that ^02tractor beam^00.
boy,0,OK. Beat your race-highscore of 00:45. Upgrade weapons in your ^05garage^00. Find two more ^04pieces^00.